{
  "id": "formal-letter",
  "title": "Formal letter",
  "title_fa": "نامهٔ اداری رسمی",
  "description": "Write a formal Persian official letter with the right structure, a polite tone and no spelling mistakes.",
  "description_fa": "نوشتن نامهٔ اداری رسمی فارسی با ساختار درست، لحن مؤدبانه و بدون غلط نگارشی",
  "publisher": {
    "name": "NetArz",
    "url": "https://gisoo.pro"
  },
  "categories": [
    "writing",
    "business"
  ],
  "tags": [
    "نامه",
    "اداری",
    "رسمی",
    "مکاتبه"
  ],
  "language": "fa",
  "version": "1.0.0",
  "license": "MIT",
  "verified": true,
  "added_at": "2026-10-27"
}
