{
  "id": "voice-meeting-summary",
  "title": "Meeting summary from a transcript",
  "title_fa": "خلاصهٔ جلسه از متن صوت",
  "description": "Turn the transcript of a meeting or call into a short summary with topics, decisions and open tasks.",
  "description_fa": "تبدیل متنِ پیاده‌شدهٔ صوت جلسه یا تماس به خلاصهٔ کوتاه با موضوع‌ها، تصمیم‌ها و کارهای باز",
  "publisher": {
    "name": "NetArz",
    "url": "https://gisoo.pro"
  },
  "categories": [
    "business",
    "productivity"
  ],
  "tags": [
    "جلسه",
    "صوت",
    "پیاده‌سازی",
    "خلاصه"
  ],
  "language": "fa",
  "version": "1.0.0",
  "license": "MIT",
  "verified": true,
  "added_at": "2026-10-27"
}
