{
  "id": "study-plan",
  "title": "Study plan",
  "title_fa": "برنامهٔ مطالعه",
  "description": "A realistic weekly study plan for an exam, a language or a new skill, with review and practice tests.",
  "description_fa": "برنامهٔ مطالعهٔ هفتگی واقع‌بینانه برای کنکور، امتحان، زبان یا یادگیری یک مهارت، با مرور و آزمون",
  "publisher": {
    "name": "Gisoo",
    "url": "https://gisoo.pro"
  },
  "categories": [
    "education",
    "productivity"
  ],
  "tags": [
    "مطالعه",
    "درس",
    "کنکور",
    "یادگیری"
  ],
  "language": "fa",
  "version": "1.0.0",
  "license": "MIT",
  "verified": true,
  "added_at": "2026-10-27"
}
